No.,Time,Source,Destination,Protocol,Length,Info,,,,,,,,,,,,,,,time 2,time 1,delay 1,delay 2,jiter 
1,0,202.70.54.17,172.20.10.7,HTTP,1414,Continuation,,,,,,,,,,,,,,,0.00013,0,0.00013,0.000541,0.000411
2,0.00013,172.20.10.7,202.70.54.17,TCP,66,49478  >  80 [ACK] Seq=1 Ack=4294965937 Win=260 Len=0 SLE=1 SRE=1361,,,,,,,,,,,,,,,0.000671,0.00013,0.000541,9.00E-05,0.000451
3,0.000671,202.70.54.17,172.20.10.7,TCP,1414,[TCP Out-Of-Order] 80  >  49478 [ACK] Seq=4294965937 Ack=1 Win=947 Len=1360,,,,,,,,,,,,,,,0.000761,0.000671,9.00E-05,0.004691,0.004601
4,0.000761,172.20.10.7,202.70.54.17,TCP,54,49478  >  80 [ACK] Seq=1 Ack=1361 Win=260 Len=0,,,,,,,,,,,,,,,0.005452,0.000761,0.004691,0.000102,0.004589
5,0.005452,202.70.54.17,172.20.10.7,HTTP,1414,[TCP Previous segment not captured] Continuation,,,,,,,,,,,,,,,0.005554,0.005452,0.000102,0.008329,0.008227
6,0.005554,172.20.10.7,202.70.54.17,TCP,66,[TCP Dup ACK 4#1] 49478  >  80 [ACK] Seq=1 Ack=1361 Win=260 Len=0 SLE=2721 SRE=4081,,,,,,,,,,,,,,,0.013883,0.005554,0.008329,0.000121,0.008208
7,0.013883,202.70.54.17,172.20.10.7,HTTP,1414,Continuation,,,,,,,,,,,,,,,0.014004,0.013883,0.000121,0.001189,0.001068
8,0.014004,172.20.10.7,202.70.54.17,TCP,66,[TCP Dup ACK 4#2] 49478  >  80 [ACK] Seq=1 Ack=1361 Win=260 Len=0 SLE=2721 SRE=5441,,,,,,,,,,,,,,,0.015193,0.014004,0.001189,0.000085,0.001104
9,0.015193,202.70.54.17,172.20.10.7,HTTP,1414,Continuation,,,,,,,,,,,,,,,0.015278,0.015193,0.000085,0.013188,0.013103
10,0.015278,172.20.10.7,202.70.54.17,TCP,66,[TCP Dup ACK 4#3] 49478  >  80 [ACK] Seq=1 Ack=1361 Win=260 Len=0 SLE=2721 SRE=6801,,,,,,,,,,,,,,,0.028466,0.015278,0.013188,0,0.013188
11,0.028466,202.70.54.17,172.20.10.7,HTTP,1414,[TCP Fast Retransmission] Continuation,,,,,,,,,,,,,,,0.028466,0.028466,0,0.000177,0.000177
12,0.028466,202.70.54.17,172.20.10.7,HTTP,462,[TCP Previous segment not captured] Continuation,,,,,,,,,,,,,,,0.028643,0.028466,0.000177,0.000163,0.000014
13,0.028643,172.20.10.7,202.70.54.17,TCP,54,49478  >  80 [ACK] Seq=1 Ack=6801 Win=260 Len=0,,,,,,,,,,,,,,,0.028806,0.028643,0.000163,0.10058,0.100417
14,0.028806,172.20.10.7,202.70.54.17,TCP,66,[TCP Dup ACK 13#1] 49478  >  80 [ACK] Seq=1 Ack=6801 Win=260 Len=0 SLE=16321 SRE=16729,,,,,,,,,,,,,,,0.129386,0.028806,0.10058,0.698302,0.597722
15,0.129386,172.20.10.7,74.125.130.138,TCP,54,49477  >  80 [ACK] Seq=1 Ack=1 Win=256 Len=0,,,,,,,,,,,,,,,0.827688,0.129386,0.698302,0.000132,0.69817
16,0.827688,202.70.54.17,172.20.10.7,TCP,1414,[TCP Retransmission] 80  >  49478 [ACK] Seq=6801 Ack=1 Win=947 Len=1360,,,,,,,,,,,,,,,0.82782,0.827688,0.000132,0.056256,0.056124
17,0.82782,172.20.10.7,202.70.54.17,TCP,66,49478  >  80 [ACK] Seq=1 Ack=8161 Win=260 Len=0 SLE=16321 SRE=16729,,,,,,,,,,,,,,,0.884076,0.82782,0.056256,0.000135,0.056121
18,0.884076,202.70.54.17,172.20.10.7,TCP,1414,[TCP Retransmission] 80  >  49478 [ACK] Seq=8161 Ack=1 Win=947 Len=1360,,,,,,,,,,,,,,,0.884211,0.884076,0.000135,0.000365,0.00023
19,0.884211,172.20.10.7,202.70.54.17,TCP,66,49478  >  80 [ACK] Seq=1 Ack=9521 Win=260 Len=0 SLE=16321 SRE=16729,,,,,,,,,,,,,,,0.884576,0.884211,0.000365,,
20,0.884576,202.70.54.17,172.20.10.7,TCP,1414,[TCP Retransmission] 80  >  49478 [ACK] Seq=10881 Ack=1 Win=947 Len=1360,,,,,,,,,,,,,,,,to dilay,0.884576,to jiter ,1.563925
21,0.884636,172.20.10.7,202.70.54.17,TCP,74,[TCP Dup ACK 19#1] 49478  >  80 [ACK] Seq=1 Ack=9521 Win=260 Len=0 SLE=10881 SRE=12241 SLE=16321 SRE=16729,,,,,,,,,,,,,,,,rata dilay,3.83E-05,rata jiter ,6.76848E-05
22,0.884794,202.70.54.17,172.20.10.7,TCP,1414,[TCP Retransmission] 80  >  49478 [ACK] Seq=9521 Ack=1 Win=947 Len=1360,,,,,,,,,,,,,,,,,,,
23,0.88485,172.20.10.7,202.70.54.17,TCP,66,49478  >  80 [ACK] Seq=1 Ack=12241 Win=260 Len=0 SLE=16321 SRE=16729,,,,,,,,(,,,,,,,,,,,
24,0.885421,202.70.54.17,172.20.10.7,TCP,1414,[TCP Retransmission] 80  >  49478 [ACK] Seq=12241 Ack=1 Win=947 Len=1360,,,,,,,,,,,,,,,,,,,
25,0.885496,172.20.10.7,202.70.54.17,TCP,66,49478  >  80 [ACK] Seq=1 Ack=13601 Win=260 Len=0 SLE=16321 SRE=16729,,,,,,,,,,,,,,,,,,,
27,2.438572,202.70.54.17,172.20.10.7,TCP,1414,[TCP Retransmission] 80  >  49478 [ACK] Seq=13601 Ack=1 Win=947 Len=1360,,,,,,,,,,,,,,,,,,,
28,2.43871,172.20.10.7,202.70.54.17,TCP,66,49478  >  80 [ACK] Seq=1 Ack=14961 Win=260 Len=0 SLE=16321 SRE=16729,,,,,,,,,,,,,,,,,,,
29,2.495527,202.70.54.17,172.20.10.7,TCP,1414,[TCP Retransmission] 80  >  49478 [ACK] Seq=14961 Ack=1 Win=947 Len=1360,,,,,,,,,,,,,,,,,,,
30,2.495676,172.20.10.7,202.70.54.17,TCP,54,49478  >  80 [ACK] Seq=1 Ack=16729 Win=260 Len=0,,,,,,,,,,,,,,,,,,,
31,3.5207,172.20.10.7,74.125.130.138,HTTP,367,GET /edgedl/release2/chrome_component/IPe0DW--vyzNNx0NkxLNjw_32.0.0.433/AKz8Q2rhuXOOMWYXiBLhv-g HTTP/1.1 ,,,,,,,,,,,,,,,,,,,
32,3.606587,74.125.130.138,172.20.10.7,HTTP,1086,HTTP/1.1 302 Found  (text/html),,,,,,,,,,,,,,,,,,,
33,3.607479,172.20.10.7,202.70.54.17,HTTP,494,GET /edgedl/release2/chrome_component/IPe0DW--vyzNNx0NkxLNjw_32.0.0.433/AKz8Q2rhuXOOMWYXiBLhv-g?cms_redirect=yes&mh=87&mip=115.178.212.69&mm=28&mn=sn-nh5gu-jb3z&ms=nvh&mt=1601831113&mv=m&mvi=6&pl=24&shardbypass=yes HTTP/1.1 ,,,,,,,,,,,,,,,,,,,
34,3.66661,202.70.54.17,172.20.10.7,HTTP,1414,[TCP Previous segment not captured] Continuation,,,,,,,,,,,,,,,,,,,
35,3.666744,172.20.10.7,202.70.54.17,TCP,66,[TCP Dup ACK 30#1] 49478  >  80 [ACK] Seq=441 Ack=16729 Win=260 Len=0 SLE=18089 SRE=19449,,,,,,,,,,,,,,,,,,,
36,3.669446,202.70.54.17,172.20.10.7,TCP,1414,[TCP Out-Of-Order] 80  >  49478 [ACK] Seq=16729 Ack=441 Win=952 Len=1360,,,,,,,,,,,,,,,,,,,
37,3.669534,172.20.10.7,202.70.54.17,TCP,54,49478  >  80 [ACK] Seq=441 Ack=19449 Win=260 Len=0,,,,,,,,,,,,,,,,,,,
38,3.672427,202.70.54.17,172.20.10.7,HTTP,1414,Continuation,,,,,,,,,,,,,,,,,,,
39,3.67635,202.70.54.17,172.20.10.7,HTTP,1414,[TCP Previous segment not captured] Continuation,,,,,,,,,,,,,,,,,,,
40,3.67648,172.20.10.7,202.70.54.17,TCP,66,49478  >  80 [ACK] Seq=441 Ack=20809 Win=260 Len=0 SLE=22169 SRE=23529,,,,,,,,,,,,,,,,,,,
41,3.679362,202.70.54.17,172.20.10.7,HTTP,1414,Continuation,,,,,,,,,,,,,,,,,,,
42,3.679421,172.20.10.7,202.70.54.17,TCP,66,[TCP Dup ACK 40#1] 49478  >  80 [ACK] Seq=441 Ack=20809 Win=260 Len=0 SLE=22169 SRE=24889,,,,,,,,,,,,,,,,,,,
43,3.682131,202.70.54.17,172.20.10.7,TCP,1414,[TCP Out-Of-Order] 80  >  49478 [ACK] Seq=20809 Ack=441 Win=952 Len=1360,,,,,,,,,,,,,,,,,,,
44,3.682204,172.20.10.7,202.70.54.17,TCP,54,49478  >  80 [ACK] Seq=441 Ack=24889 Win=260 Len=0,,,,,,,,,,,,,,,,,,,
45,3.696646,202.70.54.17,172.20.10.7,HTTP,1414,Continuation,,,,,,,,,,,,,,,,,,,
46,3.701583,202.70.54.17,172.20.10.7,HTTP,1414,Continuation,,,,,,,,,,,,,,,,,,,
47,3.7017,172.20.10.7,202.70.54.17,TCP,54,49478  >  80 [ACK] Seq=441 Ack=27609 Win=260 Len=0,,,,,,,,,,,,,,,,,,,
48,3.706477,202.70.54.17,172.20.10.7,HTTP,1414,Continuation,,,,,,,,,,,,,,,,,,,
49,3.709476,202.70.54.17,172.20.10.7,HTTP,1414,Continuation,,,,,,,,,,,,,,,,,,,
50,3.709584,172.20.10.7,202.70.54.17,TCP,54,49478  >  80 [ACK] Seq=441 Ack=30329 Win=260 Len=0,,,,,,,,,,,,,,,,,,,
51,3.714268,202.70.54.17,172.20.10.7,HTTP,1067,Continuation,,,,,,,,,,,,,,,,,,,
52,3.806554,172.20.10.7,74.125.130.138,TCP,54,49477  >  80 [ACK] Seq=314 Ack=1033 Win=260 Len=0,,,,,,,,,,,,,,,,,,,
53,3.91255,172.20.10.7,202.70.54.17,TCP,54,49478  >  80 [ACK] Seq=441 Ack=31342 Win=256 Len=0,,,,,,,,,,,,,,,,,,,
55,4.519999,172.20.10.7,74.125.130.138,HTTP,367,GET /edgedl/release2/chrome_component/IPe0DW--vyzNNx0NkxLNjw_32.0.0.433/AKz8Q2rhuXOOMWYXiBLhv-g HTTP/1.1 ,,,,,,,,,,,,,,,,,,,
56,4.584469,74.125.130.138,172.20.10.7,HTTP,1086,HTTP/1.1 302 Found  (text/html),,,,,,,,,,,,,,,,,,,
57,4.585916,172.20.10.7,202.70.54.17,HTTP,494,GET /edgedl/release2/chrome_component/IPe0DW--vyzNNx0NkxLNjw_32.0.0.433/AKz8Q2rhuXOOMWYXiBLhv-g?cms_redirect=yes&mh=87&mip=115.178.212.69&mm=28&mn=sn-nh5gu-jb3z&ms=nvh&mt=1601831052&mv=m&mvi=6&pl=24&shardbypass=yes HTTP/1.1 ,,,,,,,,,,,,,,,,,,,
58,4.639587,202.70.54.17,172.20.10.7,TCP,1414,[TCP Previous segment not captured] 80  >  49478 [ACK] Seq=32702 Ack=881 Win=956 Len=1360 [TCP segment of a reassembled PDU],,,,,,,,,,,,,,,,,,,
59,4.639715,172.20.10.7,202.70.54.17,TCP,66,[TCP Dup ACK 53#1] 49478  >  80 [ACK] Seq=881 Ack=31342 Win=256 Len=0 SLE=32702 SRE=34062,,,,,,,,,,,,,,,,,,,
60,4.641317,202.70.54.17,172.20.10.7,TCP,1414,80  >  49478 [ACK] Seq=34062 Ack=881 Win=956 Len=1360 [TCP segment of a reassembled PDU],,,,,,,,,,,,,,,,,,,
61,4.641427,172.20.10.7,202.70.54.17,TCP,66,[TCP Dup ACK 53#2] 49478  >  80 [ACK] Seq=881 Ack=31342 Win=256 Len=0 SLE=32702 SRE=35422,,,,,,,,,,,,,,,,,,,
62,4.649362,202.70.54.17,172.20.10.7,TCP,1414,80  >  49478 [ACK] Seq=35422 Ack=881 Win=956 Len=1360 [TCP segment of a reassembled PDU],,,,,,,,,,,,,,,,,,,
63,4.649473,172.20.10.7,202.70.54.17,TCP,66,[TCP Dup ACK 53#3] 49478  >  80 [ACK] Seq=881 Ack=31342 Win=256 Len=0 SLE=32702 SRE=36782,,,,,,,,,,,,,,,,,,,
64,4.649755,202.70.54.17,172.20.10.7,TCP,1414,80  >  49478 [ACK] Seq=36782 Ack=881 Win=956 Len=1360 [TCP segment of a reassembled PDU],,,,,,,,,,,,,,,,,,,
65,4.649804,172.20.10.7,202.70.54.17,TCP,66,[TCP Dup ACK 53#4] 49478  >  80 [ACK] Seq=881 Ack=31342 Win=256 Len=0 SLE=32702 SRE=38142,,,,,,,,,,,,,,,,,,,
66,4.654301,202.70.54.17,172.20.10.7,TCP,1414,[TCP Fast Retransmission] 80  >  49478 [ACK] Seq=31342 Ack=881 Win=956 Len=1360 [TCP segment of a reassembled PDU],,,,,,,,,,,,,,,,,,,
67,4.654452,172.20.10.7,202.70.54.17,TCP,54,49478  >  80 [ACK] Seq=881 Ack=38142 Win=260 Len=0,,,,,,,,,,,,,,,,,,,
68,4.668707,202.70.54.17,172.20.10.7,TCP,1414,[TCP Previous segment not captured] 80  >  49478 [ACK] Seq=39502 Ack=881 Win=956 Len=1360 [TCP segment of a reassembled PDU],,,,,,,,,,,,,,,,,,,
69,4.668707,202.70.54.17,172.20.10.7,TCP,1414,80  >  49478 [ACK] Seq=40862 Ack=881 Win=956 Len=1360 [TCP segment of a reassembled PDU],,,,,,,,,,,,,,,,,,,
70,4.668867,172.20.10.7,202.70.54.17,TCP,66,[TCP Dup ACK 67#1] 49478  >  80 [ACK] Seq=881 Ack=38142 Win=260 Len=0 SLE=39502 SRE=40862,,,,,,,,,,,,,,,,,,,
71,4.669029,172.20.10.7,202.70.54.17,TCP,66,[TCP Dup ACK 67#2] 49478  >  80 [ACK] Seq=881 Ack=38142 Win=260 Len=0 SLE=39502 SRE=42222,,,,,,,,,,,,,,,,,,,
72,4.671885,202.70.54.17,172.20.10.7,TCP,1414,[TCP Fast Retransmission] 80  >  49478 [ACK] Seq=38142 Ack=881 Win=956 Len=1360 [TCP segment of a reassembled PDU],,,,,,,,,,,,,,,,,,,
73,4.672024,172.20.10.7,202.70.54.17,TCP,54,49478  >  80 [ACK] Seq=881 Ack=42222 Win=260 Len=0,,,,,,,,,,,,,,,,,,,
74,4.673255,202.70.54.17,172.20.10.7,TCP,444,"80  >  49478 [PSH, ACK] Seq=42222 Ack=881 Win=956 Len=390 [TCP segment of a reassembled PDU]",,,,,,,,,,,,,,,,,,,
75,4.784589,172.20.10.7,74.125.130.138,TCP,54,49477  >  80 [ACK] Seq=627 Ack=2065 Win=256 Len=0,,,,,,,,,,,,,,,,,,,
76,4.882594,172.20.10.7,202.70.54.17,TCP,54,49478  >  80 [ACK] Seq=881 Ack=42612 Win=258 Len=0,,,,,,,,,,,,,,,,,,,
77,5.515982,172.20.10.7,74.125.130.138,HTTP,367,GET /edgedl/release2/chrome_component/IPe0DW--vyzNNx0NkxLNjw_32.0.0.433/AKz8Q2rhuXOOMWYXiBLhv-g HTTP/1.1 ,,,,,,,,,,,,,,,,,,,
78,5.596256,74.125.130.138,172.20.10.7,HTTP,1086,HTTP/1.1 302 Found  (text/html),,,,,,,,,,,,,,,,,,,
79,5.60187,172.20.10.7,202.70.54.17,HTTP,494,GET /edgedl/release2/chrome_component/IPe0DW--vyzNNx0NkxLNjw_32.0.0.433/AKz8Q2rhuXOOMWYXiBLhv-g?cms_redirect=yes&mh=87&mip=115.178.212.69&mm=28&mn=sn-nh5gu-jb3z&ms=nvh&mt=1601831113&mv=m&mvi=6&pl=24&shardbypass=yes HTTP/1.1 ,,,,,,,,,,,,,,,,,,,
80,5.664376,202.70.54.17,172.20.10.7,TCP,1414,80  >  49478 [ACK] Seq=42612 Ack=1321 Win=960 Len=1360 [TCP segment of a reassembled PDU],,,,,,,,,,,,,,,,,,,
81,5.66902,202.70.54.17,172.20.10.7,TCP,1414,80  >  49478 [ACK] Seq=43972 Ack=1321 Win=960 Len=1360 [TCP segment of a reassembled PDU],,,,,,,,,,,,,,,,,,,
82,5.6691,172.20.10.7,202.70.54.17,TCP,54,49478  >  80 [ACK] Seq=1321 Ack=45332 Win=260 Len=0,,,,,,,,,,,,,,,,,,,
83,5.680363,202.70.54.17,172.20.10.7,TCP,1414,80  >  49478 [ACK] Seq=45332 Ack=1321 Win=960 Len=1360 [TCP segment of a reassembled PDU],,,,,,,,,,,,,,,,,,,
84,5.689385,202.70.54.17,172.20.10.7,TCP,1414,80  >  49478 [ACK] Seq=46692 Ack=1321 Win=960 Len=1360 [TCP segment of a reassembled PDU],,,,,,,,,,,,,,,,,,,
85,5.689514,172.20.10.7,202.70.54.17,TCP,54,49478  >  80 [ACK] Seq=1321 Ack=48052 Win=260 Len=0,,,,,,,,,,,,,,,,,,,
86,5.696232,202.70.54.17,172.20.10.7,TCP,1414,[TCP Previous segment not captured] 80  >  49478 [ACK] Seq=49412 Ack=1321 Win=960 Len=1360 [TCP segment of a reassembled PDU],,,,,,,,,,,,,,,,,,,
87,5.696351,172.20.10.7,202.70.54.17,TCP,66,[TCP Dup ACK 85#1] 49478  >  80 [ACK] Seq=1321 Ack=48052 Win=260 Len=0 SLE=49412 SRE=50772,,,,,,,,,,,,,,,,,,,
88,5.699245,202.70.54.17,172.20.10.7,TCP,1414,[TCP Retransmission] 80  >  49478 [ACK] Seq=48052 Ack=1321 Win=960 Len=1360,,,,,,,,,,,,,,,,,,,
89,5.699245,202.70.54.17,172.20.10.7,TCP,454,"[TCP Previous segment not captured] 80  >  49478 [PSH, ACK] Seq=65732 Ack=1321 Win=960 Len=400 [TCP segment of a reassembled PDU]",,,,,,,,,,,,,,,,,,,
90,5.69939,172.20.10.7,202.70.54.17,TCP,54,49478  >  80 [ACK] Seq=1321 Ack=50772 Win=260 Len=0,,,,,,,,,,,,,,,,,,,
91,5.699561,172.20.10.7,202.70.54.17,TCP,66,[TCP Dup ACK 90#1] 49478  >  80 [ACK] Seq=1321 Ack=50772 Win=260 Len=0 SLE=65732 SRE=66132,,,,,,,,,,,,,,,,,,,
92,5.795627,172.20.10.7,74.125.130.138,TCP,54,49477  >  80 [ACK] Seq=940 Ack=3097 Win=260 Len=0,,,,,,,,,,,,,,,,,,,
93,6.331688,202.70.54.17,172.20.10.7,TCP,1414,[TCP Retransmission] 80  >  49478 [ACK] Seq=50772 Ack=1321 Win=960 Len=1360,,,,,,,,,,,,,,,,,,,
94,6.331821,172.20.10.7,202.70.54.17,TCP,66,49478  >  80 [ACK] Seq=1321 Ack=52132 Win=260 Len=0 SLE=65732 SRE=66132,,,,,,,,,,,,,,,,,,,
95,6.391691,202.70.54.17,172.20.10.7,TCP,1414,[TCP Retransmission] 80  >  49478 [ACK] Seq=52132 Ack=1321 Win=960 Len=1360,,,,,,,,,,,,,,,,,,,
96,6.391814,172.20.10.7,202.70.54.17,TCP,66,49478  >  80 [ACK] Seq=1321 Ack=53492 Win=260 Len=0 SLE=65732 SRE=66132,,,,,,,,,,,,,,,,,,,
97,6.394693,202.70.54.17,172.20.10.7,TCP,1414,[TCP Retransmission] 80  >  49478 [ACK] Seq=53492 Ack=1321 Win=960 Len=1360,,,,,,,,,,,,,,,,,,,
98,6.394814,172.20.10.7,202.70.54.17,TCP,66,49478  >  80 [ACK] Seq=1321 Ack=54852 Win=260 Len=0 SLE=65732 SRE=66132,,,,,,,,,,,,,,,,,,,
99,6.398441,202.70.54.17,172.20.10.7,TCP,1414,[TCP Retransmission] 80  >  49478 [ACK] Seq=54852 Ack=1321 Win=960 Len=1360,,,,,,,,,,,,,,,,,,,
100,6.398567,172.20.10.7,202.70.54.17,TCP,66,49478  >  80 [ACK] Seq=1321 Ack=56212 Win=260 Len=0 SLE=65732 SRE=66132,,,,,,,,,,,,,,,,,,,
101,7.555263,202.70.54.17,172.20.10.7,TCP,1414,[TCP Retransmission] 80  >  49478 [ACK] Seq=56212 Ack=1321 Win=960 Len=1360,,,,,,,,,,,,,,,,,,,
102,7.555392,172.20.10.7,202.70.54.17,TCP,66,49478  >  80 [ACK] Seq=1321 Ack=57572 Win=260 Len=0 SLE=65732 SRE=66132,,,,,,,,,,,,,,,,,,,
103,7.595957,202.70.54.17,172.20.10.7,TCP,1414,[TCP Retransmission] 80  >  49478 [ACK] Seq=57572 Ack=1321 Win=960 Len=1360,,,,,,,,,,,,,,,,,,,
104,7.59608,172.20.10.7,202.70.54.17,TCP,66,49478  >  80 [ACK] Seq=1321 Ack=58932 Win=260 Len=0 SLE=65732 SRE=66132,,,,,,,,,,,,,,,,,,,
105,7.60599,202.70.54.17,172.20.10.7,TCP,1414,[TCP Retransmission] 80  >  49478 [ACK] Seq=58932 Ack=1321 Win=960 Len=1360,,,,,,,,,,,,,,,,,,,
106,7.606116,172.20.10.7,202.70.54.17,TCP,66,49478  >  80 [ACK] Seq=1321 Ack=60292 Win=260 Len=0 SLE=65732 SRE=66132,,,,,,,,,,,,,,,,,,,
107,7.608955,202.70.54.17,172.20.10.7,TCP,1414,[TCP Retransmission] 80  >  49478 [ACK] Seq=60292 Ack=1321 Win=960 Len=1360,,,,,,,,,,,,,,,,,,,
108,7.609079,172.20.10.7,202.70.54.17,TCP,66,49478  >  80 [ACK] Seq=1321 Ack=61652 Win=260 Len=0 SLE=65732 SRE=66132,,,,,,,,,,,,,,,,,,,
109,7.61098,202.70.54.17,172.20.10.7,TCP,1414,[TCP Retransmission] 80  >  49478 [ACK] Seq=61652 Ack=1321 Win=960 Len=1360,,,,,,,,,,,,,,,,,,,
110,7.611036,172.20.10.7,202.70.54.17,TCP,66,49478  >  80 [ACK] Seq=1321 Ack=63012 Win=260 Len=0 SLE=65732 SRE=66132,,,,,,,,,,,,,,,,,,,
111,7.668365,202.70.54.17,172.20.10.7,TCP,1414,[TCP Retransmission] 80  >  49478 [ACK] Seq=64372 Ack=1321 Win=960 Len=1360,,,,,,,,,,,,,,,,,,,
112,7.668365,202.70.54.17,172.20.10.7,TCP,1414,[TCP Retransmission] 80  >  49478 [ACK] Seq=63012 Ack=1321 Win=960 Len=1360,,,,,,,,,,,,,,,,,,,
113,7.668499,172.20.10.7,202.70.54.17,TCP,66,[TCP Dup ACK 110#1] 49478  >  80 [ACK] Seq=1321 Ack=63012 Win=260 Len=0 SLE=64372 SRE=66132,,,,,,,,,,,,,,,,,,,
114,7.668702,172.20.10.7,202.70.54.17,TCP,54,49478  >  80 [ACK] Seq=1321 Ack=66132 Win=260 Len=0,,,,,,,,,,,,,,,,,,,
115,7.676001,172.20.10.7,74.125.130.138,HTTP,367,GET /edgedl/release2/chrome_component/IPe0DW--vyzNNx0NkxLNjw_32.0.0.433/AKz8Q2rhuXOOMWYXiBLhv-g HTTP/1.1 ,,,,,,,,,,,,,,,,,,,
116,7.738116,74.125.130.138,172.20.10.7,HTTP,1086,HTTP/1.1 302 Found  (text/html),,,,,,,,,,,,,,,,,,,
117,7.741374,172.20.10.7,202.70.54.17,HTTP,494,GET /edgedl/release2/chrome_component/IPe0DW--vyzNNx0NkxLNjw_32.0.0.433/AKz8Q2rhuXOOMWYXiBLhv-g?cms_redirect=yes&mh=87&mip=115.178.212.69&mm=28&mn=sn-nh5gu-jb3z&ms=nvh&mt=1601831052&mv=m&mvi=6&pl=24&shardbypass=yes HTTP/1.1 ,,,,,,,,,,,,,,,,,,,
118,7.807246,202.70.54.17,172.20.10.7,TCP,1414,80  >  49478 [ACK] Seq=66132 Ack=1761 Win=964 Len=1360 [TCP segment of a reassembled PDU],,,,,,,,,,,,,,,,,,,
119,7.936703,172.20.10.7,74.125.130.138,TCP,54,49477  >  80 [ACK] Seq=1253 Ack=4129 Win=256 Len=0,,,,,,,,,,,,,,,,,,,
120,8.000309,202.70.54.17,172.20.10.7,TCP,1158,"[TCP Previous segment not captured] 80  >  49478 [PSH, ACK] Seq=82452 Ack=1761 Win=964 Len=1104 [TCP segment of a reassembled PDU]",,,,,,,,,,,,,,,,,,,
121,8.000432,172.20.10.7,202.70.54.17,TCP,66,49478  >  80 [ACK] Seq=1761 Ack=67492 Win=260 Len=0 SLE=82452 SRE=83556,,,,,,,,,,,,,,,,,,,
122,8.079301,202.70.54.17,172.20.10.7,TCP,1414,[TCP Retransmission] 80  >  49478 [ACK] Seq=67492 Ack=1761 Win=964 Len=1360,,,,,,,,,,,,,,,,,,,
123,8.079425,172.20.10.7,202.70.54.17,TCP,66,49478  >  80 [ACK] Seq=1761 Ack=68852 Win=260 Len=0 SLE=82452 SRE=83556,,,,,,,,,,,,,,,,,,,
124,8.700246,202.70.54.17,172.20.10.7,TCP,1414,[TCP Retransmission] 80  >  49478 [ACK] Seq=68852 Ack=1761 Win=964 Len=1360,,,,,,,,,,,,,,,,,,,
125,8.700374,172.20.10.7,202.70.54.17,TCP,66,49478  >  80 [ACK] Seq=1761 Ack=70212 Win=260 Len=0 SLE=82452 SRE=83556,,,,,,,,,,,,,,,,,,,
126,8.752795,202.70.54.17,172.20.10.7,TCP,1414,[TCP Retransmission] 80  >  49478 [ACK] Seq=70212 Ack=1761 Win=964 Len=1360,,,,,,,,,,,,,,,,,,,
127,8.752918,172.20.10.7,202.70.54.17,TCP,66,49478  >  80 [ACK] Seq=1761 Ack=71572 Win=260 Len=0 SLE=82452 SRE=83556,,,,,,,,,,,,,,,,,,,
128,8.758458,202.70.54.17,172.20.10.7,TCP,1414,[TCP Retransmission] 80  >  49478 [ACK] Seq=72932 Ack=1761 Win=964 Len=1360,,,,,,,,,,,,,,,,,,,
129,8.758577,172.20.10.7,202.70.54.17,TCP,74,[TCP Dup ACK 127#1] 49478  >  80 [ACK] Seq=1761 Ack=71572 Win=260 Len=0 SLE=72932 SRE=74292 SLE=82452 SRE=83556,,,,,,,,,,,,,,,,,,,
130,8.758945,202.70.54.17,172.20.10.7,TCP,1414,[TCP Retransmission] 80  >  49478 [ACK] Seq=71572 Ack=1761 Win=964 Len=1360,,,,,,,,,,,,,,,,,,,
131,8.759007,172.20.10.7,202.70.54.17,TCP,66,49478  >  80 [ACK] Seq=1761 Ack=74292 Win=260 Len=0 SLE=82452 SRE=83556,,,,,,,,,,,,,,,,,,,
132,9.78253,202.70.54.17,172.20.10.7,TCP,1414,[TCP Retransmission] 80  >  49478 [ACK] Seq=74292 Ack=1761 Win=964 Len=1360,,,,,,,,,,,,,,,,,,,
133,9.782661,172.20.10.7,202.70.54.17,TCP,66,49478  >  80 [ACK] Seq=1761 Ack=75652 Win=260 Len=0 SLE=82452 SRE=83556,,,,,,,,,,,,,,,,,,,
134,9.856297,202.70.54.17,172.20.10.7,TCP,1414,[TCP Retransmission] 80  >  49478 [ACK] Seq=75652 Ack=1761 Win=964 Len=1360,,,,,,,,,,,,,,,,,,,
135,9.856422,172.20.10.7,202.70.54.17,TCP,66,49478  >  80 [ACK] Seq=1761 Ack=77012 Win=260 Len=0 SLE=82452 SRE=83556,,,,,,,,,,,,,,,,,,,
136,9.86509,202.70.54.17,172.20.10.7,TCP,1414,[TCP Retransmission] 80  >  49478 [ACK] Seq=77012 Ack=1761 Win=964 Len=1360,,,,,,,,,,,,,,,,,,,
137,9.865172,172.20.10.7,202.70.54.17,TCP,66,49478  >  80 [ACK] Seq=1761 Ack=78372 Win=260 Len=0 SLE=82452 SRE=83556,,,,,,,,,,,,,,,,,,,
138,9.868159,202.70.54.17,172.20.10.7,TCP,1414,[TCP Retransmission] 80  >  49478 [ACK] Seq=78372 Ack=1761 Win=964 Len=1360,,,,,,,,,,,,,,,,,,,
139,9.868159,202.70.54.17,172.20.10.7,TCP,1414,[TCP Retransmission] 80  >  49478 [ACK] Seq=79732 Ack=1761 Win=964 Len=1360,,,,,,,,,,,,,,,,,,,
140,9.868288,172.20.10.7,202.70.54.17,TCP,66,49478  >  80 [ACK] Seq=1761 Ack=79732 Win=260 Len=0 SLE=82452 SRE=83556,,,,,,,,,,,,,,,,,,,
141,9.86844,172.20.10.7,202.70.54.17,TCP,66,49478  >  80 [ACK] Seq=1761 Ack=81092 Win=260 Len=0 SLE=82452 SRE=83556,,,,,,,,,,,,,,,,,,,
142,9.897964,202.70.54.17,172.20.10.7,TCP,1414,[TCP Retransmission] 80  >  49478 [ACK] Seq=81092 Ack=1761 Win=964 Len=1360,,,,,,,,,,,,,,,,,,,
143,9.898109,172.20.10.7,202.70.54.17,TCP,54,49478  >  80 [ACK] Seq=1761 Ack=83556 Win=260 Len=0,,,,,,,,,,,,,,,,,,,
144,9.902143,172.20.10.7,74.125.130.138,HTTP,367,GET /edgedl/release2/chrome_component/IPe0DW--vyzNNx0NkxLNjw_32.0.0.433/AKz8Q2rhuXOOMWYXiBLhv-g HTTP/1.1 ,,,,,,,,,,,,,,,,,,,
145,9.965848,74.125.130.138,172.20.10.7,HTTP,1086,HTTP/1.1 302 Found  (text/html),,,,,,,,,,,,,,,,,,,
146,9.967438,172.20.10.7,202.70.54.17,HTTP,494,GET /edgedl/release2/chrome_component/IPe0DW--vyzNNx0NkxLNjw_32.0.0.433/AKz8Q2rhuXOOMWYXiBLhv-g?cms_redirect=yes&mh=87&mip=115.178.212.69&mm=28&mn=sn-nh5gu-jb3z&ms=nvh&mt=1601831113&mv=m&mvi=6&pl=24&shardbypass=yes HTTP/1.1 ,,,,,,,,,,,,,,,,,,,
147,10.03577,202.70.54.17,172.20.10.7,TCP,54,80  >  49478 [ACK] Seq=83556 Ack=2201 Win=968 Len=0,,,,,,,,,,,,,,,,,,,
148,10.167855,172.20.10.7,74.125.130.138,TCP,54,49477  >  80 [ACK] Seq=1566 Ack=5161 Win=260 Len=0,,,,,,,,,,,,,,,,,,,
149,10.192451,202.70.54.17,172.20.10.7,TCP,1414,80  >  49478 [ACK] Seq=83556 Ack=2201 Win=968 Len=1360 [TCP segment of a reassembled PDU],,,,,,,,,,,,,,,,,,,
150,10.194195,202.70.54.17,172.20.10.7,TCP,1414,80  >  49478 [ACK] Seq=84916 Ack=2201 Win=968 Len=1360 [TCP segment of a reassembled PDU],,,,,,,,,,,,,,,,,,,
151,10.194312,172.20.10.7,202.70.54.17,TCP,54,49478  >  80 [ACK] Seq=2201 Ack=86276 Win=260 Len=0,,,,,,,,,,,,,,,,,,,
152,10.467924,202.70.54.17,172.20.10.7,TCP,128,"[TCP Previous segment not captured] 80  >  49478 [PSH, ACK] Seq=97156 Ack=2201 Win=968 Len=74 [TCP segment of a reassembled PDU]",,,,,,,,,,,,,,,,,,,
153,10.468037,172.20.10.7,202.70.54.17,TCP,66,[TCP Dup ACK 151#1] 49478  >  80 [ACK] Seq=2201 Ack=86276 Win=260 Len=0 SLE=97156 SRE=97230,,,,,,,,,,,,,,,,,,,
154,10.5243,202.70.54.17,172.20.10.7,TCP,1414,[TCP Retransmission] 80  >  49478 [ACK] Seq=86276 Ack=2201 Win=968 Len=1360,,,,,,,,,,,,,,,,,,,
155,10.524434,172.20.10.7,202.70.54.17,TCP,66,49478  >  80 [ACK] Seq=2201 Ack=87636 Win=260 Len=0 SLE=97156 SRE=97230,,,,,,,,,,,,,,,,,,,
156,10.584568,202.70.54.17,172.20.10.7,TCP,1414,[TCP Retransmission] 80  >  49478 [ACK] Seq=87636 Ack=2201 Win=968 Len=1360,,,,,,,,,,,,,,,,,,,
157,10.58469,172.20.10.7,202.70.54.17,TCP,66,49478  >  80 [ACK] Seq=2201 Ack=88996 Win=260 Len=0 SLE=97156 SRE=97230,,,,,,,,,,,,,,,,,,,
158,11.117591,202.70.54.17,172.20.10.7,TCP,1414,[TCP Retransmission] 80  >  49478 [ACK] Seq=88996 Ack=2201 Win=968 Len=1360,,,,,,,,,,,,,,,,,,,
159,11.117723,172.20.10.7,202.70.54.17,TCP,66,49478  >  80 [ACK] Seq=2201 Ack=90356 Win=260 Len=0 SLE=97156 SRE=97230,,,,,,,,,,,,,,,,,,,
160,11.175633,202.70.54.17,172.20.10.7,TCP,1414,[TCP Retransmission] 80  >  49478 [ACK] Seq=91716 Ack=2201 Win=968 Len=1360,,,,,,,,,,,,,,,,,,,
161,11.175752,172.20.10.7,202.70.54.17,TCP,74,[TCP Dup ACK 159#1] 49478  >  80 [ACK] Seq=2201 Ack=90356 Win=260 Len=0 SLE=91716 SRE=93076 SLE=97156 SRE=97230,,,,,,,,,,,,,,,,,,,
162,11.176965,202.70.54.17,172.20.10.7,TCP,1414,[TCP Retransmission] 80  >  49478 [ACK] Seq=90356 Ack=2201 Win=968 Len=1360,,,,,,,,,,,,,,,,,,,
163,11.177029,172.20.10.7,202.70.54.17,TCP,66,49478  >  80 [ACK] Seq=2201 Ack=93076 Win=260 Len=0 SLE=97156 SRE=97230,,,,,,,,,,,,,,,,,,,
164,12.255943,202.70.54.17,172.20.10.7,TCP,1414,[TCP Retransmission] 80  >  49478 [ACK] Seq=93076 Ack=2201 Win=968 Len=1360,,,,,,,,,,,,,,,,,,,
165,12.256075,172.20.10.7,202.70.54.17,TCP,66,49478  >  80 [ACK] Seq=2201 Ack=94436 Win=260 Len=0 SLE=97156 SRE=97230,,,,,,,,,,,,,,,,,,,
166,12.334563,202.70.54.17,172.20.10.7,TCP,1414,[TCP Retransmission] 80  >  49478 [ACK] Seq=95796 Ack=2201 Win=968 Len=1360,,,,,,,,,,,,,,,,,,,
167,12.334745,172.20.10.7,202.70.54.17,TCP,66,[TCP Dup ACK 165#1] 49478  >  80 [ACK] Seq=2201 Ack=94436 Win=260 Len=0 SLE=95796 SRE=97230,,,,,,,,,,,,,,,,,,,
168,12.338034,202.70.54.17,172.20.10.7,TCP,1414,[TCP Retransmission] 80  >  49478 [ACK] Seq=94436 Ack=2201 Win=968 Len=1360,,,,,,,,,,,,,,,,,,,
169,12.338138,172.20.10.7,202.70.54.17,TCP,54,49478  >  80 [ACK] Seq=2201 Ack=97230 Win=260 Len=0,,,,,,,,,,,,,,,,,,,
170,12.348397,172.20.10.7,74.125.130.138,HTTP,367,GET /edgedl/release2/chrome_component/IPe0DW--vyzNNx0NkxLNjw_32.0.0.433/AKz8Q2rhuXOOMWYXiBLhv-g HTTP/1.1 ,,,,,,,,,,,,,,,,,,,
171,12.420198,74.125.130.138,172.20.10.7,HTTP,1086,HTTP/1.1 302 Found  (text/html),,,,,,,,,,,,,,,,,,,
172,12.4211,172.20.10.7,202.70.54.17,HTTP,494,GET /edgedl/release2/chrome_component/IPe0DW--vyzNNx0NkxLNjw_32.0.0.433/AKz8Q2rhuXOOMWYXiBLhv-g?cms_redirect=yes&mh=87&mip=115.178.212.69&mm=28&mn=sn-nh5gu-jb3z&ms=nvh&mt=1601831113&mv=m&mvi=6&pl=24&shardbypass=yes HTTP/1.1 ,,,,,,,,,,,,,,,,,,,
173,12.481972,202.70.54.17,172.20.10.7,TCP,54,80  >  49478 [ACK] Seq=97230 Ack=2641 Win=973 Len=0,,,,,,,,,,,,,,,,,,,
174,12.578432,202.70.54.17,172.20.10.7,HTTP,1414,[TCP Previous segment not captured] Continuation,,,,,,,,,,,,,,,,,,,
175,12.578554,172.20.10.7,202.70.54.17,TCP,66,[TCP Dup ACK 169#1] 49478  >  80 [ACK] Seq=2641 Ack=97230 Win=260 Len=0 SLE=98590 SRE=99950,,,,,,,,,,,,,,,,,,,
176,12.578909,202.70.54.17,172.20.10.7,TCP,1414,[TCP Out-Of-Order] 80  >  49478 [ACK] Seq=97230 Ack=2641 Win=973 Len=1360,,,,,,,,,,,,,,,,,,,
177,12.579055,172.20.10.7,202.70.54.17,TCP,54,49478  >  80 [ACK] Seq=2641 Ack=99950 Win=260 Len=0,,,,,,,,,,,,,,,,,,,
178,12.588248,202.70.54.17,172.20.10.7,HTTP,1414,[TCP Previous segment not captured] Continuation,,,,,,,,,,,,,,,,,,,
179,12.588355,172.20.10.7,202.70.54.17,TCP,66,[TCP Dup ACK 177#1] 49478  >  80 [ACK] Seq=2641 Ack=99950 Win=260 Len=0 SLE=101310 SRE=102670,,,,,,,,,,,,,,,,,,,
180,12.588597,202.70.54.17,172.20.10.7,HTTP,1414,Continuation,,,,,,,,,,,,,,,,,,,
181,12.588641,172.20.10.7,202.70.54.17,TCP,66,[TCP Dup ACK 177#2] 49478  >  80 [ACK] Seq=2641 Ack=99950 Win=260 Len=0 SLE=101310 SRE=104030,,,,,,,,,,,,,,,,,,,
182,12.601443,202.70.54.17,172.20.10.7,HTTP,1414,[TCP Fast Retransmission] Continuation,,,,,,,,,,,,,,,,,,,
183,12.601568,172.20.10.7,202.70.54.17,TCP,54,49478  >  80 [ACK] Seq=2641 Ack=104030 Win=260 Len=0,,,,,,,,,,,,,,,,,,,
184,12.606139,202.70.54.17,172.20.10.7,HTTP,492,[TCP Previous segment not captured] Continuation,,,,,,,,,,,,,,,,,,,
185,12.606252,172.20.10.7,202.70.54.17,TCP,66,[TCP Dup ACK 183#1] 49478  >  80 [ACK] Seq=2641 Ack=104030 Win=260 Len=0 SLE=106750 SRE=107188,,,,,,,,,,,,,,,,,,,
186,12.615916,172.20.10.7,74.125.130.138,TCP,54,49477  >  80 [ACK] Seq=1879 Ack=6193 Win=256 Len=0,,,,,,,,,,,,,,,,,,,
187,13.112073,202.70.54.17,172.20.10.7,TCP,1414,[TCP Retransmission] 80  >  49478 [ACK] Seq=104030 Ack=2641 Win=973 Len=1360,,,,,,,,,,,,,,,,,,,
188,13.112203,172.20.10.7,202.70.54.17,TCP,66,49478  >  80 [ACK] Seq=2641 Ack=105390 Win=260 Len=0 SLE=106750 SRE=107188,,,,,,,,,,,,,,,,,,,
189,13.161689,202.70.54.17,172.20.10.7,TCP,1414,[TCP Retransmission] 80  >  49478 [ACK] Seq=105390 Ack=2641 Win=973 Len=1360,,,,,,,,,,,,,,,,,,,
190,13.161834,172.20.10.7,202.70.54.17,TCP,54,49478  >  80 [ACK] Seq=2641 Ack=107188 Win=260 Len=0,,,,,,,,,,,,,,,,,,,
191,14.344527,172.20.10.7,74.125.130.138,HTTP,367,GET /edgedl/release2/chrome_component/IPe0DW--vyzNNx0NkxLNjw_32.0.0.433/AKz8Q2rhuXOOMWYXiBLhv-g HTTP/1.1 ,,,,,,,,,,,,,,,,,,,
192,14.417025,74.125.130.138,172.20.10.7,HTTP,1086,HTTP/1.1 302 Found  (text/html),,,,,,,,,,,,,,,,,,,
193,14.418532,172.20.10.7,202.70.54.17,HTTP,494,GET /edgedl/release2/chrome_component/IPe0DW--vyzNNx0NkxLNjw_32.0.0.433/AKz8Q2rhuXOOMWYXiBLhv-g?cms_redirect=yes&mh=87&mip=115.178.212.69&mm=28&mn=sn-nh5gu-jb3z&ms=nvh&mt=1601831113&mv=m&mvi=6&pl=24&shardbypass=yes HTTP/1.1 ,,,,,,,,,,,,,,,,,,,
194,14.475038,202.70.54.17,172.20.10.7,TCP,54,80  >  49478 [ACK] Seq=107188 Ack=3081 Win=977 Len=0,,,,,,,,,,,,,,,,,,,
195,14.477032,202.70.54.17,172.20.10.7,HTTP,1414,[TCP Previous segment not captured] Continuation,,,,,,,,,,,,,,,,,,,
196,14.477157,172.20.10.7,202.70.54.17,TCP,66,[TCP Dup ACK 190#1] 49478  >  80 [ACK] Seq=3081 Ack=107188 Win=260 Len=0 SLE=108548 SRE=109908,,,,,,,,,,,,,,,,,,,
197,14.487553,202.70.54.17,172.20.10.7,TCP,1414,[TCP Retransmission] 80  >  49478 [ACK] Seq=107188 Ack=3081 Win=977 Len=1360,,,,,,,,,,,,,,,,,,,
198,14.487553,202.70.54.17,172.20.10.7,HTTP,1414,Continuation,,,,,,,,,,,,,,,,,,,
199,14.487792,172.20.10.7,202.70.54.17,TCP,54,49478  >  80 [ACK] Seq=3081 Ack=109908 Win=260 Len=0,,,,,,,,,,,,,,,,,,,
200,14.493124,202.70.54.17,172.20.10.7,HTTP,1414,Continuation,,,,,,,,,,,,,,,,,,,
201,14.49324,172.20.10.7,202.70.54.17,TCP,54,49478  >  80 [ACK] Seq=3081 Ack=112628 Win=260 Len=0,,,,,,,,,,,,,,,,,,,
202,14.494001,202.70.54.17,172.20.10.7,HTTP,1414,[TCP Previous segment not captured] Continuation,,,,,,,,,,,,,,,,,,,
203,14.494102,172.20.10.7,202.70.54.17,TCP,66,[TCP Dup ACK 201#1] 49478  >  80 [ACK] Seq=3081 Ack=112628 Win=260 Len=0 SLE=113988 SRE=115348,,,,,,,,,,,,,,,,,,,
204,14.49549,202.70.54.17,172.20.10.7,HTTP,1414,Continuation,,,,,,,,,,,,,,,,,,,
205,14.49561,172.20.10.7,202.70.54.17,TCP,66,[TCP Dup ACK 201#2] 49478  >  80 [ACK] Seq=3081 Ack=112628 Win=260 Len=0 SLE=113988 SRE=116708,,,,,,,,,,,,,,,,,,,
206,14.503384,202.70.54.17,172.20.10.7,HTTP,1414,[TCP Fast Retransmission] Continuation,,,,,,,,,,,,,,,,,,,
207,14.503526,172.20.10.7,202.70.54.17,TCP,54,49478  >  80 [ACK] Seq=3081 Ack=116708 Win=260 Len=0,,,,,,,,,,,,,,,,,,,
208,14.503841,202.70.54.17,172.20.10.7,HTTP,1414,[TCP Previous segment not captured] Continuation,,,,,,,,,,,,,,,,,,,
209,14.503949,172.20.10.7,202.70.54.17,TCP,66,[TCP Dup ACK 207#1] 49478  >  80 [ACK] Seq=3081 Ack=116708 Win=260 Len=0 SLE=118068 SRE=119428,,,,,,,,,,,,,,,,,,,
210,14.51229,202.70.54.17,172.20.10.7,TCP,1414,[TCP Retransmission] 80  >  49478 [ACK] Seq=116708 Ack=3081 Win=977 Len=1360,,,,,,,,,,,,,,,,,,,
211,14.512428,172.20.10.7,202.70.54.17,TCP,54,49478  >  80 [ACK] Seq=3081 Ack=119428 Win=260 Len=0,,,,,,,,,,,,,,,,,,,
212,14.621995,172.20.10.7,74.125.130.138,TCP,54,49477  >  80 [ACK] Seq=2192 Ack=7225 Win=260 Len=0,,,,,,,,,,,,,,,,,,,
213,14.945912,202.70.54.17,172.20.10.7,HTTP,1414,Continuation,,,,,,,,,,,,,,,,,,,
214,15.198023,172.20.10.7,202.70.54.17,TCP,54,49478  >  80 [ACK] Seq=3081 Ack=120788 Win=260 Len=0,,,,,,,,,,,,,,,,,,,
215,15.246081,202.70.54.17,172.20.10.7,HTTP,1414,[TCP Previous segment not captured] Continuation,,,,,,,,,,,,,,,,,,,
216,15.246081,202.70.54.17,172.20.10.7,TCP,1414,[TCP Out-Of-Order] 80  >  49478 [ACK] Seq=120788 Ack=3081 Win=977 Len=1360,,,,,,,,,,,,,,,,,,,
217,15.246212,172.20.10.7,202.70.54.17,TCP,66,[TCP Dup ACK 214#1] 49478  >  80 [ACK] Seq=3081 Ack=120788 Win=260 Len=0 SLE=122148 SRE=123508,,,,,,,,,,,,,,,,,,,
218,15.246387,172.20.10.7,202.70.54.17,TCP,54,49478  >  80 [ACK] Seq=3081 Ack=123508 Win=260 Len=0,,,,,,,,,,,,,,,,,,,
219,15.247067,202.70.54.17,172.20.10.7,HTTP,1414,Continuation,,,,,,,,,,,,,,,,,,,
220,15.305069,202.70.54.17,172.20.10.7,HTTP,793,[TCP Previous segment not captured] Continuation,,,,,,,,,,,,,,,,,,,
221,15.305188,172.20.10.7,202.70.54.17,TCP,66,49478  >  80 [ACK] Seq=3081 Ack=124868 Win=260 Len=0 SLE=128948 SRE=129687,,,,,,,,,,,,,,,,,,,
222,16.188471,202.70.54.17,172.20.10.7,TCP,1414,[TCP Retransmission] 80  >  49478 [ACK] Seq=124868 Ack=3081 Win=977 Len=1360,,,,,,,,,,,,,,,,,,,
223,16.188652,172.20.10.7,202.70.54.17,TCP,66,49478  >  80 [ACK] Seq=3081 Ack=126228 Win=260 Len=0 SLE=128948 SRE=129687,,,,,,,,,,,,,,,,,,,
224,16.246348,202.70.54.17,172.20.10.7,TCP,1414,[TCP Retransmission] 80  >  49478 [ACK] Seq=127588 Ack=3081 Win=977 Len=1360,,,,,,,,,,,,,,,,,,,
225,16.246469,172.20.10.7,202.70.54.17,TCP,66,[TCP Dup ACK 223#1] 49478  >  80 [ACK] Seq=3081 Ack=126228 Win=260 Len=0 SLE=127588 SRE=129687,,,,,,,,,,,,,,,,,,,
226,16.261103,202.70.54.17,172.20.10.7,TCP,1414,[TCP Retransmission] 80  >  49478 [ACK] Seq=126228 Ack=3081 Win=977 Len=1360,,,,,,,,,,,,,,,,,,,
227,16.261252,172.20.10.7,202.70.54.17,TCP,54,49478  >  80 [ACK] Seq=3081 Ack=129687 Win=260 Len=0,,,,,,,,,,,,,,,,,,,
228,16.272829,172.20.10.7,74.125.130.138,HTTP,367,GET /edgedl/release2/chrome_component/IPe0DW--vyzNNx0NkxLNjw_32.0.0.433/AKz8Q2rhuXOOMWYXiBLhv-g HTTP/1.1 ,,,,,,,,,,,,,,,,,,,
229,16.338103,74.125.130.138,172.20.10.7,HTTP,1086,HTTP/1.1 302 Found  (text/html),,,,,,,,,,,,,,,,,,,
230,16.353556,172.20.10.7,202.70.54.17,HTTP,494,GET /edgedl/release2/chrome_component/IPe0DW--vyzNNx0NkxLNjw_32.0.0.433/AKz8Q2rhuXOOMWYXiBLhv-g?cms_redirect=yes&mh=87&mip=115.178.212.69&mm=28&mn=sn-nh5gu-jb3z&ms=nvh&mt=1601831052&mv=m&mvi=6&pl=24&shardbypass=yes HTTP/1.1 ,,,,,,,,,,,,,,,,,,,
231,16.414327,202.70.54.17,172.20.10.7,HTTP,1414,[TCP Previous segment not captured] Continuation,,,,,,,,,,,,,,,,,,,
232,16.414501,172.20.10.7,202.70.54.17,TCP,66,[TCP Dup ACK 227#1] 49478  >  80 [ACK] Seq=3521 Ack=129687 Win=260 Len=0 SLE=131047 SRE=132407,,,,,,,,,,,,,,,,,,,
233,16.420459,202.70.54.17,172.20.10.7,TCP,1414,[TCP Retransmission] 80  >  49478 [ACK] Seq=129687 Ack=3521 Win=981 Len=1360,,,,,,,,,,,,,,,,,,,
234,16.420459,202.70.54.17,172.20.10.7,HTTP,1414,Continuation,,,,,,,,,,,,,,,,,,,
235,16.420657,172.20.10.7,202.70.54.17,TCP,54,49478  >  80 [ACK] Seq=3521 Ack=132407 Win=260 Len=0,,,,,,,,,,,,,,,,,,,
236,16.538064,172.20.10.7,74.125.130.138,TCP,54,49477  >  80 [ACK] Seq=2505 Ack=8257 Win=256 Len=0,,,,,,,,,,,,,,,,,,,
237,16.620073,172.20.10.7,202.70.54.17,TCP,54,49478  >  80 [ACK] Seq=3521 Ack=133767 Win=260 Len=0,,,,,,,,,,,,,,,,,,,
238,16.853226,202.70.54.17,172.20.10.7,HTTP,689,[TCP Previous segment not captured] Continuation,,,,,,,,,,,,,,,,,,,
239,16.853344,172.20.10.7,202.70.54.17,TCP,66,[TCP Dup ACK 237#1] 49478  >  80 [ACK] Seq=3521 Ack=133767 Win=260 Len=0 SLE=140567 SRE=141202,,,,,,,,,,,,,,,,,,,
240,16.904188,202.70.54.17,172.20.10.7,TCP,1414,[TCP Retransmission] 80  >  49478 [ACK] Seq=133767 Ack=3521 Win=981 Len=1360,,,,,,,,,,,,,,,,,,,
241,16.904354,172.20.10.7,202.70.54.17,TCP,66,49478  >  80 [ACK] Seq=3521 Ack=135127 Win=260 Len=0 SLE=140567 SRE=141202,,,,,,,,,,,,,,,,,,,
242,16.966146,202.70.54.17,172.20.10.7,TCP,1414,[TCP Retransmission] 80  >  49478 [ACK] Seq=136487 Ack=3521 Win=981 Len=1360,,,,,,,,,,,,,,,,,,,
243,16.966272,172.20.10.7,202.70.54.17,TCP,74,[TCP Dup ACK 241#1] 49478  >  80 [ACK] Seq=3521 Ack=135127 Win=260 Len=0 SLE=136487 SRE=137847 SLE=140567 SRE=141202,,,,,,,,,,,,,,,,,,,
244,16.977062,202.70.54.17,172.20.10.7,TCP,1414,[TCP Retransmission] 80  >  49478 [ACK] Seq=135127 Ack=3521 Win=981 Len=1360,,,,,,,,,,,,,,,,,,,
245,16.977199,172.20.10.7,202.70.54.17,TCP,66,49478  >  80 [ACK] Seq=3521 Ack=137847 Win=260 Len=0 SLE=140567 SRE=141202,,,,,,,,,,,,,,,,,,,
246,17.403047,202.70.54.17,172.20.10.7,TCP,1414,[TCP Retransmission] 80  >  49478 [ACK] Seq=137847 Ack=3521 Win=981 Len=1360,,,,,,,,,,,,,,,,,,,
247,17.40317,172.20.10.7,202.70.54.17,TCP,66,49478  >  80 [ACK] Seq=3521 Ack=139207 Win=260 Len=0 SLE=140567 SRE=141202,,,,,,,,,,,,,,,,,,,
248,17.462323,202.70.54.17,172.20.10.7,TCP,1414,[TCP Retransmission] 80  >  49478 [ACK] Seq=139207 Ack=3521 Win=981 Len=1360,,,,,,,,,,,,,,,,,,,
249,17.462486,172.20.10.7,202.70.54.17,TCP,54,49478  >  80 [ACK] Seq=3521 Ack=141202 Win=260 Len=0,,,,,,,,,,,,,,,,,,,
250,18.46825,172.20.10.7,74.125.130.138,HTTP,367,GET /edgedl/release2/chrome_component/IPe0DW--vyzNNx0NkxLNjw_32.0.0.433/AKz8Q2rhuXOOMWYXiBLhv-g HTTP/1.1 ,,,,,,,,,,,,,,,,,,,
251,18.52527,74.125.130.138,172.20.10.7,HTTP,1086,HTTP/1.1 302 Found  (text/html),,,,,,,,,,,,,,,,,,,
252,18.526786,172.20.10.7,202.70.54.17,HTTP,494,GET /edgedl/release2/chrome_component/IPe0DW--vyzNNx0NkxLNjw_32.0.0.433/AKz8Q2rhuXOOMWYXiBLhv-g?cms_redirect=yes&mh=87&mip=115.178.212.69&mm=28&mn=sn-nh5gu-jb3z&ms=nvh&mt=1601831052&mv=m&mvi=6&pl=24&shardbypass=yes HTTP/1.1 ,,,,,,,,,,,,,,,,,,,
253,18.586213,202.70.54.17,172.20.10.7,TCP,1414,80  >  49478 [ACK] Seq=141202 Ack=3961 Win=985 Len=1360 [TCP segment of a reassembled PDU],,,,,,,,,,,,,,,,,,,
254,18.595048,202.70.54.17,172.20.10.7,TCP,1414,80  >  49478 [ACK] Seq=142562 Ack=3961 Win=985 Len=1360 [TCP segment of a reassembled PDU],,,,,,,,,,,,,,,,,,,
255,18.595174,172.20.10.7,202.70.54.17,TCP,54,49478  >  80 [ACK] Seq=3961 Ack=143922 Win=260 Len=0,,,,,,,,,,,,,,,,,,,
256,18.600216,202.70.54.17,172.20.10.7,TCP,1414,[TCP Previous segment not captured] 80  >  49478 [ACK] Seq=145282 Ack=3961 Win=985 Len=1360 [TCP segment of a reassembled PDU],,,,,,,,,,,,,,,,,,,
257,18.600329,172.20.10.7,202.70.54.17,TCP,66,[TCP Dup ACK 255#1] 49478  >  80 [ACK] Seq=3961 Ack=143922 Win=260 Len=0 SLE=145282 SRE=146642,,,,,,,,,,,,,,,,,,,
258,18.606126,202.70.54.17,172.20.10.7,TCP,1414,[TCP Retransmission] 80  >  49478 [ACK] Seq=143922 Ack=3961 Win=985 Len=1360,,,,,,,,,,,,,,,,,,,
259,18.606281,172.20.10.7,202.70.54.17,TCP,54,49478  >  80 [ACK] Seq=3961 Ack=146642 Win=260 Len=0,,,,,,,,,,,,,,,,,,,
260,18.610994,202.70.54.17,172.20.10.7,TCP,1414,80  >  49478 [ACK] Seq=146642 Ack=3961 Win=985 Len=1360 [TCP segment of a reassembled PDU],,,,,,,,,,,,,,,,,,,
261,18.612978,202.70.54.17,172.20.10.7,TCP,1414,80  >  49478 [ACK] Seq=148002 Ack=3961 Win=985 Len=1360 [TCP segment of a reassembled PDU],,,,,,,,,,,,,,,,,,,
262,18.613106,172.20.10.7,202.70.54.17,TCP,54,49478  >  80 [ACK] Seq=3961 Ack=149362 Win=260 Len=0,,,,,,,,,,,,,,,,,,,
263,18.64039,202.70.54.17,172.20.10.7,TCP,1414,80  >  49478 [ACK] Seq=149362 Ack=3961 Win=985 Len=1360 [TCP segment of a reassembled PDU],,,,,,,,,,,,,,,,,,,
264,18.64039,202.70.54.17,172.20.10.7,TCP,239,"[TCP Previous segment not captured] 80  >  49478 [PSH, ACK] Seq=157522 Ack=3961 Win=985 Len=185 [TCP segment of a reassembled PDU]",,,,,,,,,,,,,,,,,,,
265,18.640528,172.20.10.7,202.70.54.17,TCP,66,49478  >  80 [ACK] Seq=3961 Ack=150722 Win=260 Len=0 SLE=157522 SRE=157707,,,,,,,,,,,,,,,,,,,
266,18.725151,172.20.10.7,74.125.130.138,TCP,54,49477  >  80 [ACK] Seq=2818 Ack=9289 Win=260 Len=0,,,,,,,,,,,,,,,,,,,
267,19.068168,202.70.54.17,172.20.10.7,TCP,1414,[TCP Retransmission] 80  >  49478 [ACK] Seq=150722 Ack=3961 Win=985 Len=1360,,,,,,,,,,,,,,,,,,,
268,19.068288,172.20.10.7,202.70.54.17,TCP,66,49478  >  80 [ACK] Seq=3961 Ack=152082 Win=260 Len=0 SLE=157522 SRE=157707,,,,,,,,,,,,,,,,,,,
269,19.117513,202.70.54.17,172.20.10.7,TCP,1414,[TCP Retransmission] 80  >  49478 [ACK] Seq=153442 Ack=3961 Win=985 Len=1360,,,,,,,,,,,,,,,,,,,
270,19.117637,172.20.10.7,202.70.54.17,TCP,74,[TCP Dup ACK 268#1] 49478  >  80 [ACK] Seq=3961 Ack=152082 Win=260 Len=0 SLE=153442 SRE=154802 SLE=157522 SRE=157707,,,,,,,,,,,,,,,,,,,
271,19.11939,202.70.54.17,172.20.10.7,TCP,1414,[TCP Retransmission] 80  >  49478 [ACK] Seq=152082 Ack=3961 Win=985 Len=1360,,,,,,,,,,,,,,,,,,,
272,19.119516,172.20.10.7,202.70.54.17,TCP,66,49478  >  80 [ACK] Seq=3961 Ack=154802 Win=260 Len=0 SLE=157522 SRE=157707,,,,,,,,,,,,,,,,,,,
273,19.832291,202.70.54.17,172.20.10.7,TCP,1414,[TCP Retransmission] 80  >  49478 [ACK] Seq=154802 Ack=3961 Win=985 Len=1360,,,,,,,,,,,,,,,,,,,
274,19.832422,172.20.10.7,202.70.54.17,TCP,66,49478  >  80 [ACK] Seq=3961 Ack=156162 Win=260 Len=0 SLE=157522 SRE=157707,,,,,,,,,,,,,,,,,,,
275,19.88426,202.70.54.17,172.20.10.7,TCP,1414,[TCP Retransmission] 80  >  49478 [ACK] Seq=156162 Ack=3961 Win=985 Len=1360,,,,,,,,,,,,,,,,,,,
276,19.884459,172.20.10.7,202.70.54.17,TCP,54,49478  >  80 [ACK] Seq=3961 Ack=157707 Win=260 Len=0,,,,,,,,,,,,,,,,,,,
277,20.89704,172.20.10.7,74.125.130.138,HTTP,367,GET /edgedl/release2/chrome_component/IPe0DW--vyzNNx0NkxLNjw_32.0.0.433/AKz8Q2rhuXOOMWYXiBLhv-g HTTP/1.1 ,,,,,,,,,,,,,,,,,,,
278,20.973311,74.125.130.138,172.20.10.7,HTTP,1086,HTTP/1.1 302 Found  (text/html),,,,,,,,,,,,,,,,,,,
